{
  "schema_version": 1,
  "id": "nuphy-kick75-io",
  "name": "Kick75 IO",
  "preview_only": false,
  "width": 18.278988,
  "height": 7.971012,
  "keys": [
    {
      "id": "key-0",
      "label": "ESC",
      "x": 0.699999,
      "y": 0.88,
      "w": 1.0,
      "h": 1.0,
      "kind": "key"
    },
    {
      "id": "key-1",
      "label": "F14",
      "x": 2.0,
      "y": 0.88,
      "w": 1.0,
      "h": 1.0,
      "kind": "key"
    },
    {
      "id": "key-2",
      "label": "F15",
      "x": 3.04001,
      "y": 0.88,
      "w": 1.0,
      "h": 1.0,
      "kind": "key"
    },
    {
      "id": "key-3",
      "label": "",
      "x": 4.079996,
      "y": 0.88,
      "w": 1.0,
      "h": 1.0,
      "kind": "key",
      "symbol": "rectangle.3.group"
    },
    {
      "id": "key-4",
      "label": "",
      "x": 5.120012,
      "y": 0.88,
      "w": 1.0,
      "h": 1.0,
      "kind": "key",
      "symbol": "magnifyingglass"
    },
    {
      "id": "key-5",
      "label": "",
      "x": 6.42001,
      "y": 0.88,
      "w": 1.0,
      "h": 1.0,
      "kind": "key",
      "symbol": "mic"
    },
    {
      "id": "key-6",
      "label": "",
      "x": 7.459996,
      "y": 0.88,
      "w": 1.0,
      "h": 1.0,
      "kind": "key",
      "symbol": "moon.zzz"
    },
    {
      "id": "key-7",
      "label": "",
      "x": 8.500012,
      "y": 0.88,
      "w": 1.0,
      "h": 1.0,
      "kind": "key",
      "symbol": "backward.end"
    },
    {
      "id": "key-8",
      "label": "",
      "x": 9.539998,
      "y": 0.88,
      "w": 1.0,
      "h": 1.0,
      "kind": "key",
      "symbol": "playpause"
    },
    {
      "id": "key-9",
      "label": "",
      "x": 10.859983,
      "y": 0.88,
      "w": 1.0,
      "h": 1.0,
      "kind": "key",
      "symbol": "forward.end"
    },
    {
      "id": "key-10",
      "label": "",
      "x": 11.899999,
      "y": 0.88,
      "w": 1.0,
      "h": 1.0,
      "kind": "key",
      "symbol": "speaker.slash"
    },
    {
      "id": "key-11",
      "label": "",
      "x": 12.939985,
      "y": 0.88,
      "w": 1.0,
      "h": 1.0,
      "kind": "key",
      "symbol": "speaker.wave.1"
    },
    {
      "id": "key-12",
      "label": "",
      "x": 13.980001,
      "y": 0.88,
      "w": 1.0,
      "h": 1.0,
      "kind": "key",
      "symbol": "speaker.wave.2"
    },
    {
      "id": "key-13",
      "label": "DEL",
      "x": 15.279999,
      "y": 0.88,
      "w": 1.0,
      "h": 1.0,
      "kind": "key"
    },
    {
      "id": "key-14",
      "label": "",
      "x": 16.579996,
      "y": 0.88,
      "w": 1.0,
      "h": 1.0,
      "kind": "knob"
    },
    {
      "id": "key-15",
      "label": "~\n`",
      "x": 0.699999,
      "y": 2.159998,
      "w": 1.0,
      "h": 1.0,
      "kind": "key"
    },
    {
      "id": "key-16",
      "label": "!\n1",
      "x": 1.74,
      "y": 2.159998,
      "w": 1.0,
      "h": 1.0,
      "kind": "key"
    },
    {
      "id": "key-17",
      "label": "@\n2",
      "x": 2.779999,
      "y": 2.159998,
      "w": 1.0,
      "h": 1.0,
      "kind": "key"
    },
    {
      "id": "key-18",
      "label": "#\n3",
      "x": 3.819985,
      "y": 2.159998,
      "w": 1.0,
      "h": 1.0,
      "kind": "key"
    },
    {
      "id": "key-19",
      "label": "$\n4",
      "x": 4.860001,
      "y": 2.159998,
      "w": 1.0,
      "h": 1.0,
      "kind": "key"
    },
    {
      "id": "key-20",
      "label": "%\n5",
      "x": 5.899987,
      "y": 2.159998,
      "w": 1.0,
      "h": 1.0,
      "kind": "key"
    },
    {
      "id": "key-21",
      "label": "^\n6",
      "x": 6.940003,
      "y": 2.159998,
      "w": 1.0,
      "h": 1.0,
      "kind": "key"
    },
    {
      "id": "key-22",
      "label": "&\n7",
      "x": 7.979989,
      "y": 2.159998,
      "w": 1.0,
      "h": 1.0,
      "kind": "key"
    },
    {
      "id": "key-23",
      "label": "*\n8",
      "x": 9.020005,
      "y": 2.159998,
      "w": 1.0,
      "h": 1.0,
      "kind": "key"
    },
    {
      "id": "key-24",
      "label": "(\n9",
      "x": 10.059991,
      "y": 2.159998,
      "w": 1.0,
      "h": 1.0,
      "kind": "key"
    },
    {
      "id": "key-25",
      "label": ")\n0",
      "x": 11.100007,
      "y": 2.159998,
      "w": 1.0,
      "h": 1.0,
      "kind": "key"
    },
    {
      "id": "key-26",
      "label": "_\n-",
      "x": 12.139993,
      "y": 2.159998,
      "w": 1.0,
      "h": 1.0,
      "kind": "key"
    },
    {
      "id": "key-27",
      "label": "+\n=",
      "x": 13.180009,
      "y": 2.159998,
      "w": 1.0,
      "h": 1.0,
      "kind": "key"
    },
    {
      "id": "key-28",
      "label": "BACKSPACE",
      "x": 14.219996,
      "y": 2.159998,
      "w": 2.06,
      "h": 1.0,
      "kind": "key"
    },
    {
      "id": "key-29",
      "label": "HOME",
      "x": 16.579996,
      "y": 2.159998,
      "w": 1.0,
      "h": 1.0,
      "kind": "key"
    },
    {
      "id": "key-30",
      "label": "TAB",
      "x": 0.699999,
      "y": 3.199997,
      "w": 1.519999,
      "h": 1.0,
      "kind": "key"
    },
    {
      "id": "key-31",
      "label": "Q",
      "x": 2.26,
      "y": 3.199997,
      "w": 1.0,
      "h": 1.0,
      "kind": "key"
    },
    {
      "id": "key-32",
      "label": "W",
      "x": 3.299992,
      "y": 3.199997,
      "w": 1.0,
      "h": 1.0,
      "kind": "key"
    },
    {
      "id": "key-33",
      "label": "E",
      "x": 4.340007,
      "y": 3.199997,
      "w": 1.0,
      "h": 1.0,
      "kind": "key"
    },
    {
      "id": "key-34",
      "label": "R",
      "x": 5.379994,
      "y": 3.199997,
      "w": 1.0,
      "h": 1.0,
      "kind": "key"
    },
    {
      "id": "key-35",
      "label": "T",
      "x": 6.42001,
      "y": 3.199997,
      "w": 1.0,
      "h": 1.0,
      "kind": "key"
    },
    {
      "id": "key-36",
      "label": "Y",
      "x": 7.459996,
      "y": 3.199997,
      "w": 1.0,
      "h": 1.0,
      "kind": "key"
    },
    {
      "id": "key-37",
      "label": "U",
      "x": 8.500012,
      "y": 3.199997,
      "w": 1.0,
      "h": 1.0,
      "kind": "key"
    },
    {
      "id": "key-38",
      "label": "I",
      "x": 9.539998,
      "y": 3.199997,
      "w": 1.0,
      "h": 1.0,
      "kind": "key"
    },
    {
      "id": "key-39",
      "label": "O",
      "x": 10.579985,
      "y": 3.199997,
      "w": 1.0,
      "h": 1.0,
      "kind": "key"
    },
    {
      "id": "key-40",
      "label": "P",
      "x": 11.62,
      "y": 3.199997,
      "w": 1.0,
      "h": 1.0,
      "kind": "key"
    },
    {
      "id": "key-41",
      "label": "{\n[",
      "x": 12.659987,
      "y": 3.199997,
      "w": 1.0,
      "h": 1.0,
      "kind": "key"
    },
    {
      "id": "key-42",
      "label": "}\n]",
      "x": 13.700002,
      "y": 3.199997,
      "w": 1.0,
      "h": 1.0,
      "kind": "key"
    },
    {
      "id": "key-43",
      "label": "|\n\\",
      "x": 14.739989,
      "y": 3.199997,
      "w": 1.540001,
      "h": 1.0,
      "kind": "key"
    },
    {
      "id": "key-44",
      "label": "PGUP",
      "x": 16.579996,
      "y": 3.199997,
      "w": 1.0,
      "h": 1.0,
      "kind": "key"
    },
    {
      "id": "key-45",
      "label": "CAPS",
      "x": 0.699999,
      "y": 4.229989,
      "w": 1.789998,
      "h": 1.0,
      "kind": "key"
    },
    {
      "id": "key-46",
      "label": "A",
      "x": 2.529999,
      "y": 4.229989,
      "w": 1.0,
      "h": 1.0,
      "kind": "key"
    },
    {
      "id": "key-47",
      "label": "S",
      "x": 3.569997,
      "y": 4.229989,
      "w": 1.0,
      "h": 1.0,
      "kind": "key"
    },
    {
      "id": "key-48",
      "label": "D",
      "x": 4.610012,
      "y": 4.229989,
      "w": 1.0,
      "h": 1.0,
      "kind": "key"
    },
    {
      "id": "key-49",
      "label": "F",
      "x": 5.649999,
      "y": 4.229989,
      "w": 1.0,
      "h": 1.0,
      "kind": "key"
    },
    {
      "id": "key-50",
      "label": "G",
      "x": 6.689985,
      "y": 4.229989,
      "w": 1.0,
      "h": 1.0,
      "kind": "key"
    },
    {
      "id": "key-51",
      "label": "H",
      "x": 7.730001,
      "y": 4.229989,
      "w": 1.0,
      "h": 1.0,
      "kind": "key"
    },
    {
      "id": "key-52",
      "label": "J",
      "x": 8.769987,
      "y": 4.229989,
      "w": 1.0,
      "h": 1.0,
      "kind": "key"
    },
    {
      "id": "key-53",
      "label": "K",
      "x": 9.810003,
      "y": 4.229989,
      "w": 1.0,
      "h": 1.0,
      "kind": "key"
    },
    {
      "id": "key-54",
      "label": "L",
      "x": 10.84999,
      "y": 4.229989,
      "w": 1.0,
      "h": 1.0,
      "kind": "key"
    },
    {
      "id": "key-55",
      "label": ":\n;",
      "x": 11.890005,
      "y": 4.229989,
      "w": 1.0,
      "h": 1.0,
      "kind": "key"
    },
    {
      "id": "key-56",
      "label": "\"\n'",
      "x": 12.929992,
      "y": 4.229989,
      "w": 1.0,
      "h": 1.0,
      "kind": "key"
    },
    {
      "id": "key-57",
      "label": "ENTER",
      "x": 13.970007,
      "y": 4.229989,
      "w": 2.31,
      "h": 1.0,
      "kind": "key"
    },
    {
      "id": "key-58",
      "label": "PGDN",
      "x": 16.579996,
      "y": 4.229989,
      "w": 1.0,
      "h": 1.0,
      "kind": "key"
    },
    {
      "id": "key-59",
      "label": "SHIFT",
      "x": 0.699999,
      "y": 5.270005,
      "w": 2.279999,
      "h": 1.0,
      "kind": "key"
    },
    {
      "id": "key-60",
      "label": "Z",
      "x": 3.019993,
      "y": 5.270005,
      "w": 1.0,
      "h": 1.0,
      "kind": "key"
    },
    {
      "id": "key-61",
      "label": "X",
      "x": 4.060009,
      "y": 5.270005,
      "w": 1.0,
      "h": 1.0,
      "kind": "key"
    },
    {
      "id": "key-62",
      "label": "C",
      "x": 5.099995,
      "y": 5.270005,
      "w": 1.0,
      "h": 1.0,
      "kind": "key"
    },
    {
      "id": "key-63",
      "label": "V",
      "x": 6.140011,
      "y": 5.270005,